<!ELEMENT catalogo (cuenta+,contenido+)>
<!ELEMENT cuenta (perfiles)>
<!ELEMENT perfiles (perfil+)>
<!ELEMENT perfil (#PCDATA)>
<!ELEMENT contenido (peliculas, programas)>
<!ELEMENT peliculas (genero+)>
<!ELEMENT programas (genero+)>
<!ELEMENT genero (titulo*)>
<!ELEMENT titulo (#PCDATA)>
<!ATTLIST cuenta correo CDATA #REQUIRED>
<!ATTLIST perfil usuario CDATA #REQUIRED idioma CDATA #REQUIRED>
<!ATTLIST genero nombre CDATA #REQUIRED>
<!ATTLIST titulo nombre CDATA #REQUIRED duracion CDATA #REQUIRED>